column_name	required	type	allowed_values	description
citation_id	true	string		Stable citation row identifier.
claim_id	true	string		Claim linked to this citation.
report_section	true	string		Reader-facing report section title.
source_id	true	string		Source identifier.
source_role	true	enum	official_regulator|legal_text|court_or_authoritative_interpretation|standards_body|standard_or_code|academic_review|academic_paper|professional_body|industry_association|vendor_first_party|government_context|trade_media|secondary_media|user_provided_source|unknown	Resolved source role.
source_title	true	string		Source title as shown in source-log.
support_status	true	enum	supported|weak|missing|out_of_scope|not_checked	Claim support status at render time.
included_in_report	true	boolean	true|false	Whether the linked claim remains in the reader-facing report.
origin_finding_id	true	string		Source finding lineage identifier for auditability.
